{
    "title": "I3S point cloud scene layer definition",
    "type": "object",
    "$schema": "http://json-schema.org/draft-04/schema",
    "description": "Describes the point cloud scene layer.",
    "properties": {
        "id": {
            "type": "integer",
            "description": "A unique identifying number for the layer. For point cloud scene layer, only a single layer is supported, therefore, id is always 0."
        },
        "layerType": {
            "type": "string",
            "description": "String indicating the layer type",
            "enum": [
                "PointCloud"
            ]
        },
        "name": {
            "type": "string",
            "description": "Represents the layer name."
        },
        "alias": {
            "type": "string",
            "description": "Represents the alias layer name."
        },
        "desc": {
            "type": "string",
            "description": "Description for the layer."
        },
        "copyrightText": {
            "type": "string",
            "description": "Copyright information to be displayed with this layer."
        },
        "capabilities": {
            "type": "array",
            "items": {
                "type": "string", 
                "enum": [
                    "View",
                    "Query"
                ],
                "enum-description" : 
                {
                    "View" : "View is supported.",
                    "Query" : "Query is supported."
                },
                "description" : "Describes the capabilities of the point cloud scene layer."
            },
            "description": "Capabilities supported by this layer."
        },
        "spatialReference": {
            "type": "object",
            "description": "An object containing the WKID or WKT identifying the spatial reference of the layer's geometry.",
            "$ref": "../../common/schema/spatialReference_schema.json"
        },
        "heightModelInfo": {
            "type": "object",
            "description": "An object containing the vertical coordinate system information.",
            "$ref": "../../common/schema/heightModelInfo_schema.json"
        },
        "serviceUpdateTimeStamp": {
            "type": "object",
            "description": "Object to provide time stamp when the I3S service or the source of the service was created or updated.",
            "$ref": "../../common/schema/serviceUpdateTimeStamp_schema.json"
        },
        "store": {
            "type": "object",
            "description": "The storage for the layer.",
            "$ref": "store_schema.json"
        },
        "attributeStorageInfo": {
            "type": "array",
            "items": {
                "type": "object",
                "description": "Describes the attribute storage for this layer.",

                
                "$ref": "attributeInfo_schema.json"
            },
            "description": "List of attributes included for this layer."
        },
    "drawingInfo": {
        "type": "object",
        "description": "An object containing drawing information.",
        "$ref": "drawingInfo_schema.json"
    },
    "elevationInfo": {
        "type": "object",
        "description": "An object containing elevation information.",
        "$ref": "elevationInfo_schema.json"
    }
},
    "required": [
        "name",
        "layerType",
        "spatialReference",
        "store",
        "attributeStorageInfo"
    ],
    "esriDocumentation": {
        "examples": [
            {
                "title": "Point cloud layer",
                "code_href" : "../examples/mile_high_3dSceneLayer.json"
            }
        ]
    }
}