{
    "id": 0,
    "layerType": "PointCloud",
    "name": "Test Data",
    "desc": "Nice Test data",
    "capabilities": [
      "View"
    ],
    "spatialReference": {
        "wkid": 4326,
        "latestWkid": 4326,
        "vcsWkid": 5703,
        "latestVcsWkid": 5703
    },
    "store": {
        "id": "",
        "profile": "PointCloud",
        "version": "2.0",
        "extent": [
            -122.45945212669568,
            38.298060753040346,
            -122.43014691292728,
            38.303939889306761
        ],
        "index": {
            "nodeVersion": 1,
            "boundingVolumeType": "obb",
            "nodesPerPage": 64,
            "lodSelectionMetricType": "density-threshold"
        },
        "defaultGeometrySchema": {
            "geometryType": "points",
            "header": [],
            "topology": "PerAttributeArray",
            "encoding": "lepcc-xyz",
            "vertexAttributes": {
                "position": {
                    "valueType": "Float64",
                    "valuesPerElement": 3
                }
            },
            "ordering": [
                "position"
            ]
        }
    },
    "attributeStorageInfo": [
        {
            "key": "1",
            "name": "ELEVATION",
            "encoding": "embedded-elevation"
        },
        {
            "key": "2",
            "name": "INTENSITY",
            "ordering": [
                "attributeValues"
            ],
            "attributeValues": {
                "valueType": "UInt16",
                "valuesPerElement": 1
            },
            "encoding": "lepcc-intensity"
        },
        {
            "key": "4",
            "name": "RGB",
            "ordering": [
                "attributeValues"
            ],
            "attributeValues": {
                "valueType": "UInt8",
                "valuesPerElement": 3
            },
            "encoding": "lepcc-rgb"
        },
        {
            "key": "8",
            "name": "CLASS_CODE",
            "ordering": [
                "attributeValues"
            ],
            "attributeValues": {
                "valueType": "UInt8",
                "valuesPerElement": 1
            }
        },
        {
            "key": "16",
            "name": "FLAGS",
            "ordering": [
                "attributeValues"
            ],
            "attributeValues": {
                "valueType": "UInt8",
                "valuesPerElement": 1
            }
        },
        {
            "key": "32",
            "name": "RETURNS",
            "ordering": [
                "attributeValues"
            ],
            "attributeValues": {
                "valueType": "UInt8",
                "valuesPerElement": 1
            }
        }
    ],
    "drawingInfo": {
        "renderer": {
            "pointSizeAlgorithm": {
                "type": "pointCloudSplatAlgorithm",
                "scaleFactor": 1,
                "minSize": 4
            },
            "pointsPerInch": 25,
            "field": "ELEVATION",
            "fieldTransformType": "none",
            "colorModulation": {
                "field": "",
                "minValue": 1,
                "maxValue": 255
            },
            "type": "pointCloudStretchRenderer",
            "stops": [
                {
                    "value": 23.91416560580215,
                  "color": [
                    88,
                    19,
                    252,
                    255
                  ]
                },
                {
                    "value": 59.9739474458430379,
                    "color": [
                        8,
                        252,
                        253,
                        255
                    ]
                },
                {
                    "value": 96.033729285883922,
                    "color": [
                        242,
                        254,
                        42,
                        255
                    ]
                },
                {
                    "value": 132.093511125924806,
                    "color": [
                        255,
                        43,
                        24,
                        255
                    ]
                }
            ]
        }
    },
    "elevationInfo": {
        "mode": "absoluteHeight"
    },
    "heightModelInfo": {
        "heightModel": "gravity_related_height",
        "vertCRS": "NAVD_1988",
        "heightUnit": "meter"
    }
}